date,weekday,theme,url,title,pin_description
2026-06-23,Tuesday,sunrise,https://goodmorning.pics/blog/good-morning-tuesday-2026-06-23/,Good Morning — Happy Tuesday,"Good morning! Happy Tuesday. A new dawn, a new chance. A fresh retro good morning tuesday picture, new every day. #goodmorning #goodmorningtuesday #sunrise #morningvibes #retroart"
2026-06-24,Wednesday,breakfast,https://goodmorning.pics/blog/good-morning-wednesday-2026-06-24/,Good Morning — Happy Wednesday,"Good morning! Happy Wednesday. A full plate and a sunny window — that's a morning done right. A fresh retro good morning wednesday picture, new every day. Easy morning recipes at Dragonfly Supply. #goodmorning #goodmorningwednesday #breakfast #morningvibes #retroart"
2026-06-25,Thursday,coffee,https://goodmorning.pics/blog/good-morning-thursday-2026-06-25/,Good Morning — Happy Thursday,"Good morning! Happy Thursday. Pour something warm, take a slow breath, and let the day come to you. A fresh retro good morning thursday picture, new every day. Start your morning with day9.coffee. #goodmorning #goodmorningthursday #morningcoffee #morningvibes #retroart"
2026-06-26,Friday,camp,https://goodmorning.pics/blog/good-morning-friday-2026-06-26/,Good Morning — Happy Friday,"Good morning! Happy Friday. There's nothing like waking up to birdsong and a campfire. A fresh retro good morning friday picture, new every day. Planning a first family campout? Dragonfly Supply has you covered. #goodmorning #goodmorningfriday #campvibes #morningvibes #retroart"
2026-06-27,Saturday,breakfast,https://goodmorning.pics/blog/good-morning-saturday-2026-06-27/,Good Morning — Happy Saturday,"Good morning! Happy Saturday. Breakfast tastes better when you take your time. A fresh retro good morning saturday picture, new every day. Easy morning recipes at Dragonfly Supply. #goodmorning #goodmorningsaturday #breakfast #morningvibes #retroart"
2026-06-28,Sunday,motivation,https://goodmorning.pics/blog/good-morning-sunday-2026-06-28/,Good Morning — Happy Sunday,"Good morning! Happy Sunday. Morning is the world quietly offering you another try. A fresh retro good morning sunday picture, new every day. #goodmorning #goodmorningsunday #morningmotivation #morningvibes #retroart"
2026-06-29,Monday,coffee,https://goodmorning.pics/blog/good-morning-monday-2026-06-29/,Good Morning — Happy Monday,"Good morning! Happy Monday. Pour something warm, take a slow breath, and let the day come to you. A fresh retro good morning monday picture, new every day. Start your morning with day9.coffee. #goodmorning #goodmorningmonday #morningcoffee #morningvibes #retroart"
2026-06-30,Tuesday,sunrise,https://goodmorning.pics/blog/good-morning-tuesday-2026-06-30/,Good Morning — Happy Tuesday,"Good morning! Happy Tuesday. The sky put on a show this morning — take a second to enjoy it. A fresh retro good morning tuesday picture, new every day. #goodmorning #goodmorningtuesday #sunrise #morningvibes #retroart"
